{"$schema":"http://json-schema.org/draft-04/schema#","id":"Service.json","title":"Service","description":"A Customer Facing Service.","type":"object","javaType":"com.ericsson.bss.cpi.entity.Service","additionalProperties":false,"properties":{"id":{"$schema":"http://json-schema.org/draft-04/schema#","id":"Id.json","title":"Id","description":"Uniquely identifies a given entity. Although this is system generated, in certain situations, it can be specified as temporary id when creating several entities as part of a single request and one entity needs to refer to another within the same request. After the entities are created, temporary ids are replaced with system generated ones. When specifying temporary ids, it is recommended that a prefix such as \"tmp\" be used, for example: \"tmp0001\".","type":"string","system-generated":true},"href":{"$schema":"http://json-schema.org/draft-04/schema#","id":"Href.json","title":"Href","description":"URI for the given entity. This is a system-generated URI for a given entity. Using this the entity can be separately addressed over Hypermedia.","type":"string","format":"uri","system-generated":true},"externalId":{"$schema":"http://json-schema.org/draft-04/schema#","id":"ExternalId.json","title":"ExternalId","description":"A unique identifier for the entity in an external system or application. The usage of this type is two-fold: It can act as an identifier which is used via a translation table to point to the system-generated identifier or it can act as a client specified unique identifier for a given entity and subsequently used to identify the entity when it is nested within another entity.","type":"string"},"versionNumber":{"type":"string","description":"The version number identifer for this entity. It is equal to the UTC creation timestamp of this version.","system-generated":true},"validFor":{"$schema":"http://json-schema.org/draft-04/schema#","id":"TimePeriod.json","title":"TimePeriod","description":"Captures the start and end date for a given period of time.","type":"object","javaType":"com.ericsson.bss.cpi.entity.TimePeriod","additionalProperties":false,"properties":{"start":{"type":"string","format":"date-time","description":"Start of the time period","system-defaults":true},"end":{"type":"string","format":"date-time","description":"End of the time period","system-defaults":true}},"required":["start"]},"characteristics":{"type":"array","uniqueItems":true,"description":"An array of name value pairs as characteristics","items":{"$schema":"http://json-schema.org/draft-04/schema#","id":"MapElement.json","title":"MapElement","description":"A object consisting of a name as the key and a value. If applicable, it can also indicate a purpose and a unique id for reference.","type":"object","javaType":"com.ericsson.bss.cpi.entity.MapElement","additionalProperties":false,"properties":{"id":{"$schema":"http://json-schema.org/draft-04/schema#","id":"ExternalId.json","title":"ExternalId","description":"A unique identifier for the entity in an external system or application. The usage of this type is two-fold: It can act as an identifier which is used via a translation table to point to the system-generated identifier or it can act as a client specified unique identifier for a given entity and subsequently used to identify the entity when it is nested within another entity.","type":"string"},"purpose":{"type":"string","description":"The purpose of this named value"},"name":{"type":"string","description":"The name associated with value in this pair"},"value":{"description":"The value associated with the name. Can be of any type"}},"required":["name","value"]}},"statuses":{"type":"array","uniqueItems":true,"description":"An array of statuses applicable for this entity along with their validity period.","items":{"$schema":"http://json-schema.org/draft-04/schema#","id":"StatusValue.json","title":"StatusValue","description":"Represents the status of an entity along with its validity period.","type":"object","javaType":"com.ericsson.bss.cpi.entity.StatusValue","additionalProperties":false,"properties":{"status":{"type":"string","description":"The status of the entity. Valid statuses are as per enumeration \"LifeCycleState\".","enum-reference":"LifeCycleState"},"reason":{"type":"string","description":"The reason for this status as per enumeration \"LifeCycleStateReason\".","enum-reference":"LifeCycleStateReason"},"validFor":{"$schema":"http://json-schema.org/draft-04/schema#","id":"TimePeriod.json","title":"TimePeriod","description":"Captures the start and end date for a given period of time.","type":"object","javaType":"com.ericsson.bss.cpi.entity.TimePeriod","additionalProperties":false,"properties":{"start":{"type":"string","format":"date-time","description":"Start of the time period","system-defaults":true},"end":{"type":"string","format":"date-time","description":"End of the time period","system-defaults":true}},"required":["start"]}},"required":["status","reason"]}},"name":{"type":"string","description":"A word, term, or phrase by which the Service is known and distinguished from other services."},"description":{"type":"string","description":"An explanation of what the service is."},"isEnabled":{"type":"boolean","description":"Signifies if this Service has been enabled for use."},"serviceType":{"type":"string","enum":["CF","RF"],"description":"Type of this Service. Either Customer Facing(CF) or Resource Facing(RF)."},"services":{"type":"array","uniqueItems":true,"description":"An array of references to Resource Facing Services linked to this Customer Facing Service.","items":{"type":"string","format":"uri","description":"A reference to a Service. Expressed as a URI."}},"resources":{"type":"array","uniqueItems":true,"description":"An array of references to Resources belonging to this Product.","items":{"type":"string","format":"uri","description":"A reference to a Resource. Expressed as a URI."}}}}