{"id":"incididunt veniam quis","href":"cxEBDsJjtdm5GWMkiuzJJePIwDuCL6RpdVkpb3ogMJNC8sj8Ce-.f9skR.B2OhVPfnCETDoBysdBKUnPFzDxJLZ7vYPHXeG6J","externalId":"ea anim","versionNumber":"dolore amet non tempor aliquip","validFor":{"start":"3083-10-20T10:55:17.709Z","end":"2342-12-18T16:26:16.596Z"},"characteristics":[{"name":"ut incididunt tempor fugiat","value":{"description":"The value associated with the name. Can be of any type"},"id":"laborum aute velit proident consectetur"}],"statuses":[{"status":"irure non anim pariatur exercitation","reason":"adipisicing eiusmod","validFor":{"start":"4839-02-20T06:14:35.762Z"}}],"name":"ex aliquip","description":"ea non","isEnabled":true,"serviceType":"CF","services":["Xj,WdT-xGKhTf","SNDJ,FUiOI,mIJAcmveqnh-mhNKCNeVllVfRx8qo+IiAW26CzOImNSOwVcdqaX8TlV,Az-xM57jvnDr4","yod,TqRqJjk2sL8r0KAp,+axppL5coActyflq44od3lbYrPpL6+WDUULU3PaWiXwiBCg.5OCGRDuW1zvXptiRePsIx-o","JIsO2KIJz,imkuTuK9d1p-3l.-3nSG6F-Z-hiuznE0gGIDYdihx8SZrTQZrCWN3EBz9E-OCbHawXijw,Dl5","z."],"resources":["u1tBOl.8l1VpdS8kaIM4IbMmUGkyIouwL"]}