{"id":"aute sunt consectetur consequat cillum","href":"DR2C+oaOPqL2CFH0W8nq4ci,T","externalId":"tempor exercitation dolor magna est","versionNumber":"proident ","validFor":{"start":"3215-05-07T14:44:17.512Z"},"characteristics":[{"name":"velit labore","value":{"description":"The value associated with the name. Can be of any type"}},{"name":"occaecat Duis dolor","value":{"description":"The value associated with the name. Can be of any type"}},{"name":"anim","value":{"description":"The value associated with the name. Can be of any type"},"purpose":"irure proident laborum in deserunt","id":"Ut consequat ut ullamco"},{"name":"pariatur","value":{"description":"The value associated with the name. Can be of any type"}}],"statuses":[{"status":"laborum dolor commodo do","reason":"ullamco culpa","validFor":{"start":"3642-03-23T13:59:21.937Z"}},{"status":"","reason":"nisi in consequat mollit"},{"status":"ut adipisicing lab","reason":"quis adipisicing anim"}],"name":"nostrud quis pariatur","description":"id Excepteur irure","isEnabled":true,"serviceType":"RF","services":["iZqb,pb7+WP1S.uU1H2KR41N0aZlHY3PngrwVZww.60AMCup7MkUZbIAIo0rvG1r5qETH"],"resources":["jEx-kQ5+8G+1i2VLsFg2idJJzR+P0rbKcfzNu4x5LpAqVsa2GkEMES5i1j7uPkaR+YdU9Eg"]}